<?xml version="1.0" encoding="UTF-8"?>

<catalogue xmlns:xsi="http://www.w3.org/2001/XMLSchema-instance" xsi:noNamespaceSchemaLocation="catalogue.xsd">>
    <cd>
        <title>Empire Burlesque</title>
        <artist>Bob Dylan</artist>
        <country>USA</country>
        <company>Columbia</company>
        <price>10.90</price>
        
    </cd>
    
    <cd>
        <title>Hide your Heart</title>
        <artist>Bonnie Tyler</artist>
        <country>UK</country>
        <company>CBS Records</company>
        <price>19.90</price>
    </cd>
    
    <cd>
        <title>Greatest Hits</title>
        <artist>Dolly Parton</artist>
        <country>USA</country>
        <company>RCA</company>
        <price>29.90</price>
    </cd>
</catalogue>
